reviewerID,asin,,,,reviewText,overall,summary,unixReviewTime,reviewTime
A2BRXREMT5WZJ0,B0002D01PY,131,,,"Rugged, robust, flexible. Couldn't ask for more in a momentary switch. Like all Boss products it will probably last longer than me.",5,Best momentary switch on the market,1358640000,"01 20, 2013"
A3IKOEE8Z3T6BH,B0002D01PY,157,,,"I got this for use with the Boss DD-20 as a tap-tempo. It does the job well, it's a little big for what it is, but definitely worth having with a delay pedal",5,Does what it's supposed to,1340582400,"06 25, 2012"
AJBBU53A0X84I,B0002D01PY,128,,,"I got this for my Boss Loop Station, but it doesn't work very well.  I keep hoping I'll find something it DOES work well with...",1,Got this for my Boss Loop Station.,1390608000,"01 25, 2014"
AFUXETAHFUXFE,B0002D01PY,110,,,No problem at all.Great quality and I am looking forward to purchasing more of this brand. Thak you very much!,5,Good,1399852800,"05 12, 2014"
A3TOCY3MSC878,B0002D01PY,101,,,I'm using this footswitch to control a drum machine. it does the job and i've had no problems with it,5,it works,1372982400,"07 5, 2013"
A2HDEN9SPBWC5I,B0002D01PY,262,,,"I could not beat the price. The pedal does what is suppose to do on my Dynamic Wah guitar pedal. It is well build and I can use it on other Boss and Roland gear. Also, it not to big. It does not hog up a lot of space on my pedal board. Very happy with this item.",5,I bought this to work on my Boss Dynamic Wah in the Harmonizer Mode,1354233600,"11 30, 2012"
AMY8AUDIBXHCI,B0002D01PY,344,,,nuff said.works great.latest purchace is used as a trigger on my drum machineused the CODA kick pedaltrigger a boss sound moduleplay it all the timealso use one on my Vocalist.  and eff mute.  and chan change.like the option of NC or NO.  saved my gig just tonight when one of my Midi controllers lost it mind an needed NO instead of normal NC.,5,have a bunch of these,1363392000,"03 16, 2013"
A3BMI7VGJT60Y7,B0002D02IU,4425,,,"Summary for those who don't want to read the whole thing: This is more than worth the money. If you're a beginner looking for a first guitar or if you're experienced and are searching for a backup/travel option or anything like that, get this. Do not hesitate. A cheap guitar doesn't ALWAYS mean a POS!Alright, full story/review:So, when I was a kid up until my early teens my (insanely talented and self-taught) older brother helped me learn how to play guitar. I got pretty decent but somewhere along the way I stopped and I've regretted it basically every day ever since then. Recently, I decided to stop internally griping about it and realized I should actually DO something about it. So, here I am.Having previously lived in a house with multiple guitarists, I have heard the sounds of expensive guitars and I have heard the sounds of the cheapest guitars (like a typical beginner's First Act). I knew there was a middle ground and I was determined to find it. I got way more than I bargained for.I began my quest knowing that my funds were limited. There was no way I could afford to dive right in and buy a high end, top of the line Fender or Martin like I had had the benefit of learning on back in the day. I knew I had to go cheap, at least for now. I began scouring the internet in search of the best rated budget guitars. After an exhaustive amount of research, I chose this one due to the positive reviews and because all of the demos I'd pulled up on YouTube were excellent. Plus, Epiphone has a pretty good reputation in general.Despite the positive reviews, I was still a bit leery; buying instruments without actually handling them first is always a bit of a gamble. Even if it sounds nice and plays well, sometimes a perfectly solid, functional instrument just doesn't FEEL right. As I went through the checkout I silently reminded myself that I could send it back for any reason. I went into this fully knowing that there was a good possibility I'd just have to bite the bullet and buy something better, even if costlier.Well, it arrived earlier this week and I am not disappointed. I certainly didn't expect perfection and I was convinced that I would find some kind of error, if only cosmetic, with such a cheap guitar. I am here to tell you that I have not found anything wrong with it. Even if I had (unless it drastically affected the sound/playability of the instrument), it would still be worth the price.Along with the guitar I bought some new strings (Martins) because 9/10 times the stock strings that come on instruments are awful. I was pleasantly surprised to find that the stock strings are more than usable. I see that some of the other reviewers disagree. Maybe their strings were older or maybe it's just preference, I don't know. All I can say is that the stock strings on my guitar were not at all corroded/old. Shockingly enough, the guitar was pretty close to being in tune right out of the box! It doesn't seem to have any trouble staying in tune, either. All of that being said, it wouldn't hurt to pick up a pack of strings just to be safe. I mean, I'm sure that when I do finally put the Martins on I'll be even more mind-blown than I already am with the way it sounds.This guitar has a full, rich sound, plays comfortably (the low action helps!), and has zero issues with buzzing or dead frets. Oh, and contrary to what other reviews have said - YES, it DOES have a truss rod. While we're talking about its positives, let's not ignore the fact that it's also super attractive with its shiny black finish. There isn't much about it that would give away its price. No, it's not a $1000 guitar but it certainly doesn't play like a $100 guitar either! I don't regret this purchase at all. Even in the future when I progress and upgrade I will definitely be keeping this lovely gem!If you're still unsure, do what I did and listen to some demos on YouTube. I doubt you'll be disappointed. (Pay no mind to the reviews the guy on the GearWire YouTube channel did. He clearly doesn't know what he's talking about and I, as well as everyone else in the comments section, was sure to express my feelings about that, haha! One user even claimed Epiphone should sue him!) Check out the video reviews by the users/companies GoldHat3, SamAshMusic, GigGear, and ShadowFW.My only complaint about this guitar is that I didn't buy it sooner!Good luck on your search, I hope this review has helped!",5,This will more than suffice,1376006400,"08 9, 2013"
A3394J1F9CN9W5,B0002D02IU,1465,,,"First off; let me start by saying I bought this guitar because it was only $100 and I was board on my deployment and wanted something to brush up on before I return home.I DID NOT: expect good quality, sound or comfortably from this guitar.I DID: want something cheap I could toss around and use out here in the desert without worrying about it getting beaten up or trashed.When I unboxed this guitar I was floored! The hardware is much higher quality than I had expected by far. The strings it came with weren't complete crap, but I swapped them out for my favorite set of strings: Ernie Ball 2406 Ernesto Palla Nylon Black and Silver Classical strings. The guitar sings beautifully; the tone is rich and vibrant.It's quite comfortable to play, I have no problems playing up to the 16th fret without this guitar having a cut away. I'm not a big fan of the pick guard that has the Epiphone 'E' on it, so I will probably end up removing it; but the sunburst is really nice looking. I have received many compliments on the look of it already.OVER ALL: this guitar is a really great instrument for the price tag. GET IT!Also; I'm buying a hard case to take it home, or shipping this guitar back home to myself because I want to keep it as part of my collection. My original thought was to buy this guitar and leave it out here at the Rec tent for other people to use after I'm gone. Even if I do decide to leave it out here; I'll be buying another one when I get home!",5,Absolutly an amazing guitar for $100,1386979200,"12 14, 2013"
A8MTE6SIYM0GY,B0002D02IU,1131,,,"This is NOT my first guitar. Nor am I breathless Epiphone supporter shouting how this guitar is the sonic equal of Taylors and Martins. It's not. Here's what it is: An exceedingly well-constucted, AMAZINGLY playable guitar. Fit, finish, feel and action were all VERY nice... Sound on the other hand? Let's face it. It's plywood all around. It SOUNDS like plywood. But that doesn't distract from the fact that it's a great guitar for $100 bucks.It's a fine ""first"" guitar. It's a great beach/camping/cabin guitar. Leave it in your car to practice at lunch. Leave it in the office. ANY guitar is better than no guitar... And this guitar is better than a LOT of other entry level guitars.Seriously consider changing strings the second you take it out of the box... New, premium strings DO make a difference.If your expectations are for a playable, rugged, affordable guitar you won't be disappointed. If sound quality is your primary concern, well... You are going to have to spend more than a hundred bucks to be happy.For my desired application, this guitar was great... I'm very happy with it and would buy it again in a heartbeat.",4,This review is different...,1397779200,"04 18, 2014"
AT9G9PT2K0PLB,B0002D02IU,112,,,It is my son's first guitar and he is learning on it well.  It is still in great condition. good quality Guitar!,5,Great Guitar!,1374537600,"07 23, 2013"
AYQCAPXJ81XTN,B0002D02IU,108,,,"this thing plays great!!  action is low but does not buzz, very easy to chord.i highly recomend this guitar.",5,WOW!!!!!!!!!,1291852800,"12 9, 2010"
AR6CAR106LX2Y,B0002D02IU,574,,,"Well constructed with quality woods, saddle/nut and bracing. Neck and frets are straight, level and do not snag. This guitar rings like a bell, stays in tune and is light weight. Do not let the low price fool you but do not expect the guitar to come set up to your tastes. Any guitar that you buy will need to be adjusted to your style of play. The strings may be too high or too light or whatever, just be ready to do a tiny bit of work to get it like you want it then it will serve you well. Do not buy a Luna, Davidson, Main Street, or any other 'no name' - get this one.",5,best bang for the money,1395792000,"03 26, 2014"
A1RSRUQVKB5EBO,B0002D02RQ,238,,,"I normally use nylon picks but do some songs with flatpicking intros and the nylons were to flappy. These picks keep a nice bright tone, very little friction on the strings - so low string noise. Enough grip to stay put in hands well too.",5,Good picks,1388448000,"12 31, 2013"
A1LHMSY3Q46PJS,B0002D02RQ,318,,,"I've been buying Dunlop pick for at least 15 years now, and I love the feel and the grip. The picks last for a really long time, and I would recommend getting several thickness' for different applications. But for sitting in a room playing around, with my acoustics and electric guitars this is a decent all round pick",5,Great picks that work great on both acoustic and electric guitars,1218672000,"08 14, 2008"
AONGA3BHTK0EG,B0002D02RQ,236,,,I tried this but ended up going back to Tortex.  I like the satin finish on the Tortex better and the way it bends.  The Ultex has a little brighter attack though and wears out less quickly.  Ultex sounds more like the Fender celluloid.,4,Stiffer and brighter than Tortex,1395187200,"03 19, 2014"
A20TFY5J3WNJU2,B0002D02RQ,128,,,Sounds great. I own 5 different gauges. I like the gripping surface. .90 is my favorite gauge and the rounded tip is super fast.,5,great picks.,1399680000,"05 10, 2014"
APEJ8EJCC8PQ8,B0002D02RQ,308,,,Guitar picks make a huge part of your tone.  Especially on acoustic.  These are the best acoustic picks on the market today in my opinion.  They have a long life and do brighten your tone.  Freshening up the picks is easy just by rubbing them on your carpet or  carpet scrap to bring back the original shape.,5,These are the best picks on the market,1357689600,"01 9, 2013"
A362IZKSMV6MA8,B0002D02RQ,411,,,"These are nice, I like the 1.14 rigidity and these are just fine for me... you will wear them out on acoustics though if you are a more aggressive player as I am.  Once these are worn, as with most picks, they sound considerably different.  Much more grainy and tin-y but that may be a plus for you?  I also like the side edges for a real mellow and / or speeding picking style.  They stay in your fingers well.",4,it's a Pick,1400025600,"05 14, 2014"
AD4MJT7YYVHP7,B0002D02RQ,145,,,The grip is excellent. But I prefer the 1.14 Sharps over these. These are sturdy and look like I won't be needing another set for quite some time,4,Same material as Jazz III Yellow,1364947200,"04 3, 2013"
AKHWZ3S1UVZAO,B0002D02RQ,252,,,"We all have different tastes in guitar picks, I know,  As I wrote elsewhere, the Dunlop Tortex are awful for acoustic, in my opinion.  These Ultex are much better.  Not as noisy, better feel.  Still not my favorites.  I'll have them with me for spares.",3,Not Bad Picks...,1402617600,"06 13, 2014"
A23HJIRA5PIMG0,B0002D02RQ,493,,,I bought the wrong gauge. I read a review that said that you should get a size less then you really want but they are wrong. I bought the .90 gauge at Guitar Center and love them. These were made for that Dave Mustain muted crunch sound. I don't know if I will use these forever but for right now I love them. Just hard enough for speed picking but light enough to stay in your hand without moving around like 1 mils do.Dunlop Ultex sound awesome and so far they still look like new.Buy em!!!!,2,Good picks but...,1347926400,"09 18, 2012"
A2O2UE0UTPOB0Q,B0002D02RQ,170,,,I love the pick attack with these.  I have used almost everything out there over 20 years of playing and have settled on this pick as my go-to choice for acoustic guitar.,5,Best picks on phosphor bronze long-life strings,1356652800,"12 28, 2012"
ADH0O8UVJOT10,B0002D02RQ,799,,,"Didn't think I'd be compelled to review something like a guitar pick, but the Dunlop Ultex has really impressed me thus far.  I use the .60 thickness, which is equivalent to the orange plastic Dunlop pick.  The orange pick is my favorite for acoustic and most electric playing, but they do wear down and fray on the edges, and have a little more friction that I'd like.This Ultex seems very resistant to wear and has surprisingly little drag over the string.  I find the matte finish very easy to grip and hold.  It gives just enough to use for smooth strumming, while being rigid enough for individual notes.Some reviewers have noted that they crack after some use.  If that turns out to be a problem, I might reconsider my review.  But out of the box, they perform as well as any pick I have used!",5,My new pick-of-choice (replacing the Dunlop Orange),1380067200,"09 25, 2013"
A3ITN3125FJETP,B0002D02RQ,267,,,"Grabbed these on impulse as I needed some new ones. Normally I used the old Fender Medium or Heavy picks, but I gotta say these are great. Stiff but flexible enough to maneuver plus they glide nicely. Not sure what could be said to prove it, but they just feel great.",5,Pickin!,1394150400,"03 7, 2014"
A2P83FWHR36WN1,B0002D02RQ,250,,,"I've used the Tortex picks for a while now, and have been really happy with them. This pick however, takes it to the next level. Very strong and great bite for a relatively thin pick. I use the .73 for acoustic and the same holds true. Great product.",5,Great Picks,1287532800,"10 20, 2010"
AOHR2Q90UXF23,B0002D05FU,304,,,"This polish was recommended in one of Dan Erlewine's books and it works great.  It really makes the natural high gloss finish on acoustic guitars pop.  The effect isn't as noticeable on darker finishes though.  It really helps on the back of the neck too, makes it slippery and fast.  Highly recommended.",5,works great for acoustics,1326758400,"01 17, 2012"
A3MTR7P9PYAALX,B0002D05FU,288,,,"I got this to clean my Washburn acoustic guitar, and it worked great. I used it to clean off the fingerprints and grime, and then would buff in a circular motion with my soft, lint-free rag, and it would act like a polish. The finish sparkled afterwards, even in the light. Great product.",5,Great for cleaning acoustics!,1347926400,"09 18, 2012"
A1365RYO0BLEMI,B0002D05FU,349,,,"Ive been using this polish since the early 80's. It doesn't smell the way some do and works fantastic on all of my guitars. Wonderful polish and has not hurt my guitars. What has hurt my guitars is me dropping them or sweating all over them, but this polish? No way. Martin knows what they're doing. I use it on my expensive nitrocellulose finishes.",5,Best Polish. Period.,1308268800,"06 17, 2011"
A2B3XQ4FCJTKHQ,B0002D05FU,162,,,"Used it once, but once was enough. Had been using Gibson Polish, although it worked fine, just couldn't force myself to use it on my Martin Veterans Model Guitar.",5,Great Polish,1353628800,"11 23, 2012"
AQDHNCD25PFE6,B0002D05FU,122,,,This product is excellent.  Cleaning is thorough and leaves no residue.  Made my little Martin look almost as good as new.,4,Great Product!,1326240000,"01 11, 2012"
A1UMM894XSEO4F,B0002D05FU,236,,,"this is the one that everyone told me I should use, being new to guitar I figured one polish (car) has to work well, that was very incorrect on my part, this is for the delicate woods and preserves them far better than ordinary polishes",5,guitar polish,1389139200,"01 8, 2014"
A6LHCT7P53RSA,B0002D05FU,166,,,I bought this for my son to clean his guitar with. He really likes it a lot. It works very well if you use it with a microfiber cloth. I would buy this product again!,5,Works great!,1353456000,"11 21, 2012"
A3C9F3SZWLWDZF,B0002D070I,340,,,"put it in my Fender dreadnaught and only wish i have held out for the the next step up in quality with the mic as well...  Love it to death, had it pertinently installed and love the sound and the versatility.  the built in volume knob it a GREAT tough.  I could go on, but there are reviews on you tube that will do a better Job than here.",5,Love it to death,1375401600,"08 2, 2013"
AXXYMIJBD0J9G,B0002D070I,804,,,"I like the fact that it can be ""partially"" installed with the cord coming out of the sound hole or it can be easily installed on a more permanent basis by cutting the cord to length and running it inside the guitar body through the end pin hole (which will have to be enlarged a bit).  Either way, once plugged in, it sounds great.  This pickup maintains the great acoustic sound of my guitar, a Blueridge BR-160.  I installed some Fishman ""under the saddle"" pickups in a few Martin guitars and this pickup sounds just as good, if not better.  If you don't mind the pickup visible in the sound hole, this is the way to go.  Another nice thing about it is the ease of changing out the batteries as compared to the undersaddle type pickups where the batteries are attached to the inside body of the guitar.",5,Excellent product!,1369008000,"05 20, 2013"
A39PQ7QR2JFXLV,B0002D070I,1247,,,"This is not a bad product, just not great.  As soon as I received it, I installed it on my custom made Grit Laskin Guitar, and played with it for over two hours.  Installation was fast, and only took a couple of minutes.  My problems with it are 3 fold:  #1.  Sounds just a bit ""tinny"" = too much on the high end, and not an equal amount of bass.  #2.  A small complaint is that you have to dismantle the entire installation just to change the batteries, and I couldn't get mine to work in ""passive"" mode.  #3.  And the biggest complaint, is that the volume control is difficult to get to when you're performing on stage.  You have to stick your finger in the hole on the top side of the strings and fumble around trying to change the volume which is very sensitive so all of sudden you can be too loud or too soft.  Like I said, it is not a bad product, just not top notch, and definitely not for professionals.  If you're just fooling around at home, or recording at home, it is fine, and will do the job for you.  BUT!!!  If you're a pro, you'll want to spend double the money and get an L. R. Baggs M-80.  The M-80 gives you the truest sound (unbelievable), works in passive mode, and is very easy to change the volume control.  Sincerely, Doc",3,Not Bad,1339459200,"06 12, 2012"
AKDQ6O42VUK1U,B0002D070I,165,,,"Great pickup, combined with the Fishman Aura Spectrum D.I. you will have an excellent experience.  Even the pick up by itself into a quality amp will make you happy.",5,Best going,1395705600,"03 25, 2014"
A1DUPFUG526MVF,B0002D070I,404,,,I was looking for a sound hole pickup and this came as one of the best and found it to be all I expected. I use it for practice and recording myself. I really like it but for the price I wish it had just a bit more otherwise its perfect. I have it on my 1994 Martin D-18  which has a big bottom end and no matter what it always sounds fine. I have had the pickup installed for four months and it is good.,4,very good,1365465600,"04 9, 2013"
AXMXE3RT660HQ,B0002D0B4K,195,,,What can I say? These are probably the most well-known pads available and probably the best. This was the best price I could find on Amazon and they arrived as described via very prompt shipping.,5,"Great Price, Best Pads",1347062400,"09 8, 2012"
A2W8RH6YUNXH83,B0002D0B4K,567,,,"Ok, so I just installed these things for my KRK 6's (no stands...just sitting on two other speakers).  What can I say?  The bass, which previously had disappeared in my studio, is now present again!  My monitors sounded kinda thin before because I was losing so much energy to my desk, but these things have made a ton of difference!  My stereo image even feels wider now!Sure, they're a little pricy, but hey...THEY WORK!  If that's what they want to charge for them, and people continue to buy them, I'm cool with that!  I'm happy with the reults my $40 got me!5/5!",5,Auralex Does It Again,1327968000,"01 31, 2012"
A13798OPDBLDCO,B0002D0B4K,270,,,"These really do work great. No more desk vibrations and the sound out of my monitors are very clear now. I do only wish i could of found these in a smaller size since they are way bigger then my 5"" monitors. If anyone knows where to get smaller ones let me know. Thanks!",5,Works Great!!,1333584000,"04 5, 2012"
A3K6M4WXNTYQEM,B0002D0B4K,361,,,"I'm using them to angle my speakers up in addition to isolating them from the desk surface. Unfortunately, these angle the speakers down by default, so I had to do some cutting and rearranging, but it worked out. If you need to cut these to fit your speakers, try to find something better than scissors, because it's quite hard to cut the foam evenly with them.",3,They work,1375833600,"08 7, 2013"
A26Y7G0VFYUYSL,B0002D0B4K,681,,,"These MoPads are pretty amazing. I recently just purchased the Atlantic 33935701 Gaming Desk so I had a feeling that I would need these pads.These pads are a must for an amateur recording studio setup with little or no acoustic treatment. Sitting your monitors or speakers on these pads will produce an even better quality sound experience and they also will get rid of unwanted bass vibrations from your desk. I love that you can use the extra pads to angle them any way you want for your set up. These pads make my bookshelf speakers sound AMAZING. It's like I'm using actual studio monitors. At $40, you can't go wrong with these pads for you studio. It is a MUST to have these.",5,Buy these MoPads to protect yourself from Audio bleeding!,1404691200,"07 7, 2014"
A8L6Z9U1TCP06,B0002D0B4K,188,,,These are laser cut pads for your studio monitors. I feel more vibration from a hard drive spinning on my desktop than the sounds coming out of my speakers. And they look professional too.,5,Just foam pads but...,1382227200,"10 20, 2013"
AAYAXHC63IX1D,B0002D0B4K,202,,,"Just what I needed for my Home Studio Monitors that sit on the table next to my Computer and my DAW system, was surprised at how many different versions I was sent, they all work well thanks heaps......",5,These Do the Job,1357257600,"01 4, 2013"
