reviewerID,asin,,,,reviewText,overall,summary,unixReviewTime,reviewTime
A206T0W1VE8K1Q,B0002CZVBE,210,,,"This thing freaking rocks! I LOVE this pedal. I can't stop using it. Sometimes I just play long, drawn out chords so I can listen to this amazing tone [in combo with distortion on my amp - it's perfect metal!!]",5,AMAZING!!*,1371772800,"06 21, 2013"
A31HQD6H4SHO2C,B0002CZVBE,145,,,excellentI like I am very happyI am looking for money for the following purchase for amazonthe pedal boss arrives in the time necessary thank you,5,boss overdrive,1326931200,"01 19, 2012"
A2EZWZ8MBEDOLN,B0002CZVBE,1554,,,"For the money, I have no complaints.  The enclosure, dials, and footswitch are all durable.  Not true bypass, but none of the BOSS pedals are.  It doesn't suck tone.  This pedal isn't the end-all be-all overdrive, but with asymmetrical clipping it fills a niche that TS pedals don't. You lose a little low end when it is engaged, but that actually works pretty well for leads- especially with humbuckers or amps with a looser kind of 'classic' distortion encountered with EL84s.  As a stand alone overdrive, I prefer other pedals.  But where this pedal really works for me is as a boost to other dirtboxes or an already overdriven amp.  You get singing, harmonic leads when it is dialed in right.  Like any overdrive, you introduce noise when the pedal is engaged and things can get hissy while you are palm muting if you crank it too far.  I am a dirtbox hoarder and I like to rotate the pedals and try different combinations.  Lately, I am running this into either the V1 Cool Cat transparent overdrive (Timmy Clone - very, very nice) or the Behringer BO-100 (which is a dead ringer for the Boss Blues Driver) then into a tube amp that is dialed in on mild crunch (Jet City Combo or Palomino Combo).  As with any overdrive, this thing will not sound very good (IMHO) running into a solid state amp.  That's just not what it was intended to do. It was intended to drive preamp tubes into saturation but YMMV. Because I'm a cheapskate (and because these things are durable like bricks) I bought it used for $20, but it is well worth the new asking price.",4,Nice pedal !,1348012800,"09 19, 2012"
APEJ8EJCC8PQ8,B0002CZVBE,198,,,"It's yellow, its metal, its Boss.  If you want your drive sound to have definition this is the pedal to get.  The best OD I have ever owned.  Makes me want to see if my tone could cut board in half.",4,Sharp and Cutting,1332979200,"03 29, 2012"
A21Q29J3ZWPDNP,B0002CZVBE,334,,,"I picked this up in order to boost my gain on my amp a bit.  It does a wonderful job of that (Drive set low and the level set high.  Tone set to taste.)  The additional noise it produces is relatively low, so you won't have any excessive staticy buzzing sound to deal with.  As with any other Boss pedals, it's well made and reliable.",5,Great boost to your amps overdrive,1255651200,"10 16, 2009"
A3DDG0WH5SBF34,B0002CZVBE,287,,,"Bought one of these 15 yrs ago used and it died a couple years back. This is one of my favorite overdrive pedals ever. Smooth tone, the right amount of gain, perfect to push a tube amp. Plus there are now dozens of (DIY or pro) mods available which add a lot more potential. Recommended.",5,Classic overdrive established over 20 yrs ago,1404432000,"07 4, 2014"
A1GMWTGXW682GB,B0002CZVBE,994,,,"I bought this pedal used and have used it with both a Fender tube amp and a Marshall solid state using clean channels. I can get a variety of tones from it with different guitars, and reccomend it as a first overdrive or to add to a collection.While I have several overdrive pedals, this one is good at giving some basic overdrive tones while keeping the amps low end. I can get decent tones from a Telecaster and Les Psul by keeping the level and tone knobs below 12 o'clock and adjusting the drive to taste.The OD sounds great through Fender clean tubes and I also tried it with a bass guitar. With some adjustment of the tone and drive knob, the bass has an overdriven tone with a good drive.The other reviews here prove this pedal is typical and iconic Boss in build quality. I find the Boss pedals good for their purpose and have mostly modded the ones I've owned after some time, but I may keep this one as is and use it as a boost. These pedals last forever and I only paid $20 for mine.",4,Good value and works well with solid state and valve amps,1344816000,"08 13, 2012"
A17CU1D2CWXOHB,B0002CZVBE,267,,,"This is a standard on my peral board along witht he Blues Driver.  This little yellow box is the most bang for your buck you are going to find in an Over Drive pedal.  It is tough, sounds like fire, and will serve you well.  For $50 there is seriously no better deal.",5,The Yellow pedal everyone should have.,1387065600,"12 15, 2013"
A2VXKVJV7KIGMD,B0002CZVBE,158,,,I use this pedal all the time now even more than the DS-1 . Great chrunch for the buck From classic blues to rock its very eash to dial the sound you want in.,5,Great Pedal,1354665600,"12 5, 2012"
ADH0O8UVJOT10,B0002CZVBE,2187,,,"I held out from trying the Boss SD-1 Super Overdrive for many years.  Like many guitarists, my first distortion pedal was a Boss DS-1, which was durable and aggressive, but also extremely frustrating.  I might have formed some negative impressions about Boss, when it was probably unfair to do so.The SD-1 is widely owned and very affordable (usually around $50).  It's similar in a lot of ways to the Ibanez TS-9 Tubescreamer, except that a Tubescreamer reissue costs twice as much.  A lot of guitarists consider the SD-1 to be more of a ""rock"" overdrive, while the TS-9 is more of a ""tube/blues"" effect.  There's probably some truth to that, but both of them are excellent pedals.However, the SD-1 really impressed me with its transparency and versatility.  You CAN simply plug into it and use it alone with a clean channel.  But that isn't necessarily the best use for the pedal - it excels as a ""booster"" pushing an already overdrive amp, or stacking with other distortion/OD pedals.  One of the best settings is turning the Level all the way up and the gain all the way down.  This adds just a little bit of grit to your tone, and really sounds great.A feel that lot of people give the SD-1 mediocre reviews for reasons that aren't fair.  You hear things like ""it cuts out too much bass"", when that's really what the pedal is supposed to do.  The midrange hump, when set up properly, can take away the muddiness of your tone and help you cut through a band during live playing.  And, like I said before, I feel as if it's MORE transparent in retaining elements of the clean tone than the TS-9, though preference between the two is entirely subjective.But you also know that it's a Boss pedal, which means it's as durable as they come.  The thing will stand up to years of abuse, and can be used in any number of roles.  If you're looking for a single pedal to make a small amp sound ""big"", there are probably better options in this range.  (Try the under-appreciated MD-2 Mega Distortion, or the excellent Joyo Ultimate Drive).  But if you understand what this pedal is supposed to do and use it for that purpose, you'll understand why this thing has been popular for over 30 years.",5,"A versatile, overlooked classic overdrive from BOSS",1356912000,"12 31, 2012"
A3JEEPYPEM9V81,B0002CZVBE,380,,,"Great as a booster, as others have said. For solos, it'll boost your mids and your signal. As an overdrive, it's great, kind of a midsy, Marshally sound. It does suck out some of the low end, but you can fix that on your amp or board or whatever. It's a Boss, it's solid - and a great price. Remember, this is overdrive - not distortion. For distortion, look at other Boss pedals.",5,For a boost and more,1336176000,"05 5, 2012"
AZ0LJNEP2VRD1,B0002CZVBE,1206,,,"I have several overdrive pedals, some of which are much more expensive than the BOSS SD-1. For a long time I overlooked my SD-1 and used other pedals. But when I went back to trying the SD-1, I was pleasantly surprised to find that this relatively inexpensive pedal is superior to some of the pedals I had been using. I don't mean merely that it's ""very good relative to its price""; I mean that it's ""very good--period."" It easily outclasses some pedals for which I paid much more. The price for this pedal sometimes goes down to about $45 on Amazon. At that price, it's an amazingly good deal. Note: This is definitely an overdive pedal; it will not deliver metal distortion (at least not by itself). If you want to ride the crazy train, look elsewhere (like Deltalab's Metal Distortion pedal). What this produces is smooth old-style overdrive. It's excellent. It sounds especially good through a dash of chorus. I plug my SD-1 into a Fender Mustang II amp and turn on the amp's chorus; the result is delicious. I've used the SD-1 with both single-coil and double-coil pickups. Both sound good, though, not surprisingly, you get a heavier punch with a humbucker. But it sounds great with single-coils too.",5,A gem!,1305417600,"05 15, 2011"
AWIG50VOI5VUV,B0002CZVHI,571,,,"Forget all the volume drop comments.  There isn't any and it does not color your tone one bit.  I have tried a couple miniature novelty pedals. They were more like a boost volume and tone pedal with tremolo thrown in.  I wanted something to dress up slow ballads, and of course ""Born On The Bayou"".  This pedal goes from nice subtle background effect to deep depth if you want it.  And no variance in your guitar tone or volume when you click it on. I play a lot of acoustic solo and this really is a nice addition to change up my sound here and there and not over do it.",5,EXCELLENT PEDAL,1395792000,"03 26, 2014"
A34O0KQV4QXWNQ,B0002CZVHI,310,,,"Sure there are fancier Tremolo pedals out there, but I've always been a fan of the Boss TR-2. It's got a more mellow and vintage Fender Tremolo output, and suits my playing to a T. Pair this beauty up with an Electro-Harmonix Cathedral Reverb pedal, and get lost for days. Definitely worth the reasonable cost!",5,Easily One Of My Favorite Tremolo Pedals,1388966400,"01 6, 2014"
ALAY8GVFBUQ9L,B0002CZVHI,144,,,This tremelo pedal works nicely and it's great when you're playing through an amp without tremelo. Problem solved! The price was also very good.,5,Nice tremelo peday.,1372636800,"07 1, 2013"
A8ANJNZAZQ6IQ,B0002CZVHI,989,,,"This is a great Tremolo pedal.It is very quiet and when used correctly, there is absolutely no signal drop or volume drop whatsoever.You can blend the Tremolo type from a smooth sinuous pulsing waveform to a sharper edged ""on/off"" type tremolo.Tremolo varies the volume of the sound. It does not vary the pitch.You have control over the ""depth"" or ""amount"" of effect, and you can control how fast the effect pulsates the sound.A very simple, popular effect that I wouldn't want to live without in some form or another.Pretty teal green color.As with all Boss products they are built like a tank and generally last forever if they are not abused or damaged.I have no idea how fast this pedal eats batteries because I use a power supply.There is no on/off clicking when depressed.There is no added hiss, hum or distortion.The battery compartment is easily accessed without having to unplug anything.Simply a great effect and quality product from Boss and tends to hold its resale value well.",5,Great Tremolo from Boss,1343520000,"07 29, 2012"
A1V7G6OGGW7AGA,B0002CZVHI,501,,,"I've played this pedal for a while now and really dig it. I'm old school, Fender Blues Deluxe reissue and Strats and Teles, this pedal has a great, warm, organic feeling tremolo that I use a lot. You can barely bring it in for some warmth, or really crank the speed and depth for a great sort of rotary speaker effect.I'll use it with the rate set at tempo for a song and record clean guitar chords up on the middle of the neck. This effect will give you a nice almost Hammond B-3 type of organ sound.",5,Great pedal!,1375920000,"08 8, 2013"
AZ0LJNEP2VRD1,B0002CZVHI,713,,,"This is a superb tremolo pedal: [1] Its dials allow for enormous control of the effect. [2] It's very sturdy--an often-noted feature of BOSS pedals. Further, [3] it's utterly easy to use, [4] allows for both 9v battery and power supply/adapter operation, and, most important of all, [5] it delivers beautiful tremolo. (Note: It comes with a 9v battery installed, but it does NOT come with a power source/adapter.) If the price is more than you're willing to pay, consider the DANELECTRO COOL CAT TREMOLO. This also delivers good tremolo, but it does not allow for as much sound-manipulation as the BOSS product; it's still quite good, but the BOSS takes the prize. I paid about $75 for mine and have zero regrets.",5,Superb,1298592000,"02 25, 2011"
AH2F47XZ5L8NR,B0002CZVHI,1989,,,"I own three units capable of tremolo: Boss TR-2, Line 6 MM4, and the Boss SL-20 Slicer (like a tremolo on steroids). Plus my amp is a Twin Reverb so it too has tremolo. If you are unfamiliar, tremolo modulates the volume as if turning it up and down rapidly.The Boss TR-2 is the simplest of the three stompboxes to operate, with three controls: ""Rate"" of modulation, ""Depth"" of modulation (how much does the volume vary), and a ""Wave"" shape (jagged, square, or somewhere on a continuum in between). Unlike the other Boss stompboxes I own (CE-5 & PH-3), the TR-2 does not seem to compress sound so that it seems like you're ""playing in a fishbowl"" (as another reviewer puts it).The ""Wave"" control is what gives the unit its sonic versatility, so it is a nice feature to have. Most tremolos have it, but not all. For the price, it can give you a decent set of classic tremolo sounds with nothing too crazy. It is the unit that Tom Morello uses on ""Guerilla Radio,"" and it does well with tremolo classics like the Smiths ""How Soon Is Now?"" I hear no volume drop problem like other reviews suggest, and this is something I am sensitive to because I generally turn modulations on/off over the course of a song rather than leave them on full time.Like all Boss stuff, the box is sturdy and I like their big, quiet footswitches over any of the little, clicky ones on other units. The color is a sort of a dull military dark green, not the most attractive thing but not bad either.The small Boss effects do not come with a power cable, so you will have to factor that into the cost. Boss instructions tell you that you need their particular adapter, but I don't know anyone who says this is a must. I run it off a pedalboard power supply and it seems to work fine. If it didn't I would not buy Boss product period.Bottom Line:(1) Gives a decent array of basic tremolo sounds, nothing crazy(2) Not a bad price (factor in a power cable)(3) Simple to operate(4) Nice casing and footswitch; drab color",5,Nice Basic Tremolo Sounds,1360108800,"02 6, 2013"
A1ARFA1NCN34UV,B0002CZVI2,175,,,"Wanted a way to plug in my BOSS ME70 to save on batteries. Didn't want to drop the money on a BOSS PSA, so I got this one instead which does the same job, just for less money.",5,cheaper alternative,1316563200,"09 21, 2011"
A165EMA3YTIM6A,B0002CZVI2,337,,,"Bought it for using Danelectro mini amp, so I don't need to worry about the battery.  It works perfectly as an adaptor should be, & you won't have any surprise by its performance. :)  two stars out because of comparing the price with the mini amp (less than $20), the adaptor is pricy ($8.50), but it still saves me $$ for the long runs.",3,Using it for Danelectro Mini Amp,1325548800,"01 3, 2012"
A2FXCGHJLVQTIX,B0002CZVI2,151,,,"I got this to power my Danelectro Honeytone amp since it eats batteries like candy.  It's a power adaptor, so it isn't too exciting, but it works fine.",5,It works,1373241600,"07 8, 2013"
AEMC16IPBZORW,B0002CZVI2,244,,,I use this mostly with my Honeytone mini amplifier and Reel Echo tape echo simulator. Works very well with no problems. A lot of Danoelectro pedals may eat up batteries and this is a great alternative when you have access to Ac voltage outlets.,5,Great for any Danlectro product.,1192492800,"10 16, 2007"
A2B58VXLLOFQKR,B0002CZVI2,241,,,"I was having some problems with my Ego Compressor comp getting noisey, sent it back and found out that It Had been using a slightly drained battery, so I got one of these and it is great, nice and quiet again, half the price of the boss one.",5,excellent quiet pedal power,1267228800,"02 27, 2010"
A356RFKNIG043B,B0002CZVI2,871,,,"This is the best little guitar pedal adapter I've used, and I've used many over the last three decades. It's exceptionally quiet, which many are not, and it puts out 9.6 volts, which will drive your pedals a little more solidly than all but a brand new alkaline battery. And you won't have to buy a new one every dozen hours!I've used this on a splitter to drive three pedals, but at four and up I can hear the current drop a bit. Still, that's a good thing because it reminds me that tone comes from my fingers, not a box on the floor. But it sure is nice to have some Gilmouresque delay, and a little extra gain driving the tubes, and this is the best 9v adapter for pedals available that I know of, including the Boss ones. Dan has released some cool, well-made pedals in the past 15 years, and this little wall wart is a worthy companion.A very good deal at 15 clams.",5,The perfect guitar pedal adapter,1383609600,"11 5, 2013"
A1C60KQ8VJZBS5,B0002CZVI2,573,,,"As stated in the title, this adapter is what you need if you use your Danelectro a lot and are going through too many batteries. You can now plug it into the wall! As advertised, it keeps electric current hum to a minimum and has functioned fine for the year or so I've owned it. The reason I took off one star is because the wire is really thin and doesn't seem too durable, so because of this I have been very careful so it doesn't get broken. You might be able to find an off-brand adapter for cheaper but this one is made for the Honeytone so you won't risk ruining it.",4,Works great with the Danelectro Honeytone,1265932800,"02 12, 2010"
A3D42ZX96FA6EW,B0002CZVI2,382,,,"...is a must if you have any of the Danelectro/FAB pedals.  As anyone who has one of these pedals knows they eat 9-volts like candy, this is the solution.  You get one of these and hook it up to a power splitter (Search for Visual Sound One Spot Multi-Plug 5 Cable) and you are good to go for up to 5 pedals!  No more battery swaps, no more searching for a 9-volt every 5 minutes...",5,This...,1340064000,"06 19, 2012"
A3MJARDJ31M698,B0002CZVI2,183,,,What can I say lower priced than most and very low distortion I could Not hear the hum but for multi pedals to save on cost I use a godlyke power supply but this Is a good power pack.,5,Works,1296864000,"02 5, 2011"
A26RLGZUUENC6E,B0002CZVI2,231,,,Got this to use with the Behringer compressor I ordered with this. They are not indicated as compatible but it worked great! Price was right. I already own two and had no problems. Quiet. No hummmmm. Buy it if you need a wall wart.,5,quiet as a mouse,1272931200,"05 4, 2010"
A2C2TKHICAZ4RS,B0002CZVK0,741,,,"My first wah was a Morley Steve Vai Bad Horsie. I loved it. It's a switchless pedal that I put through hell. I had it for 3 months before I had to send it back cause it broke. It's still an ok pedal but I wanted the ability to leave the pedal ""open"" to achieve a certain warm sound. That's when I went looking at the cry baby.At the local retailer they had several different kinds of cry babies set up. I put this one against the Hendrix, Classic, and 95-Q cry baby pedals and this basic one sounded by far the best. The only one that sounded better was the 535Q but at over $200 it was out of my price range. I paid $97+tax for my GCB-95 cry baby and it was worth every penny. I don't even touch my Morley anymore. It's cry baby all the way",5,Great affordable Wah wah pedal,1242172800,"05 13, 2009"
A22Z554ZQ8NFPC,B0002CZVK0,530,,,"I've been using a Crybaby for going on 30 years now.  Some guitarists claim that having them in your signal chain affects your tone in a negative way.  Well, I've never noticed.To me these always feel perfect.  Also, you can adjust which part of the sweep you're using very easily - ie if you want more treble or bass you just the little ""comb"" that moves the wheel on the pot.I've tried other wahs.  Morley doesn't do it for me, and the Vox is very good, I just have always gone with what I knew.  No complaints with the Crybaby.",5,The best,1373328000,"07 9, 2013"
A4BTCECGQAIUI,B0002CZVK0,212,,,"I got this pedal cause is not so expensive, and I love music. I used to play in big concerts but no more but I can tell you that for the price is good who ever wants to have some fun and learn how to use a pedal.",5,good,1365465600,"04 9, 2013"
A7E0CJH464L82,B0002CZVK0,343,,,"Well, just got one of this and been messin with it for a couple of hours...Now that's a Fun king wah wah!!It's big, it's hard and it's heavy but when you turn it on you understand why this is the original. It sounds exactly like how i always imagined, like in all those records...This one gets the big 5 for being everything i wanted it to be!",5,Now that's a wah wah!,1336953600,"05 14, 2012"
A13A81NN0NRD1S,B0002CZVK0,657,,,"MY experience with crybaby is it has a great tone.  More overbearing than the Vox or cleaner wahs.  BUT I know several people who have had problems with the switch, and I have watched countless others stomping on their crybaby in futile attempts to engage or disengage the pedal.I actually use a BBE and Vox since this frustration with my 1st wah.  But I am not sure that I am giving up tone in exchange for the headache avoidance!  I kinda think I am.  The VOX and BBE seem to have a brighter sound which is less ""wah-ed"" if you will.  It could be accentuated by me playing a Strat instead of the Les Paul Custom/Boogie combination I used with the crybaby.",4,"GREAT TONE, but moody switch!",1273363200,"05 9, 2010"
A1YAAMQT5G88XE,B0002CZVK0,167,,,"Great pedal, but if you pull it open and put in a couple of cheap mods, this thing is absolutley rediculous!  It's a boutique pedal with only a little time and solder.",5,Mod it,1264809600,"01 30, 2010"
A1UPZM995ZAH90,B0002CZVK0,136,,,In my opinion this is one of the finest pedals to exist. The crybaby is still on my pedalboard and will be for as long as I can foresee.,5,Dunlop The Original Crybaby Pedal,1390089600,"01 19, 2014"
AN1RO6C6I78YO,B0002CZVK0,404,,,"WaWa pedals come and go, and get modded and re-thunk....But I always wanted an original Cry Baby... So this was a birthday gift to myself.Not disappointed.Down the road I MAY add some of the gazillions of electronic mods available now to personalize the sound, but for the time being I'm gonna enjoy this pedal ""As-Shipped"".Very Good Buy, Great packaging, earlier-than-expected delivery - Thanks Amazon !",5,Everything I Ever Expected...,1342224000,"07 14, 2012"
A1BH17V8BKLES,B0002CZVK0,487,,,"My Cry Baby is about 20 years old and is the oldest pedal on my board. I have rewired it for true bypass and replaced the Potentiometer to give the Wah a broader range but it really doesn't sound any better. This pedal covers the ""White Room"" by Cream Tone perfectly. I gave it 4 stars because it hasn't been maintenance free. The pot came loose and the switch had to be replaced but considering the fact that it survived several hundred gigs in smoky dives, I probably should give it 5.",4,Takes a licking and keeps on.... Wahing,1394928000,"03 16, 2014"
A1JNV4K56GG94R,B0002CZVK0,171,,,"Sounds like my original.  Enough said.  Great pedal and it is still built like a tank.  I do appreciate that on this version, one can use a pretty standard AC adapter. A+.",5,It Cries,1398211200,"04 23, 2014"
A73CB1NVPYDZ5,B0002CZVK0,576,,,"The problem with this pedal is that you have to step all the way down on it to turn it on, which produces a sound.  The Morley pedals have a separate on/off switch, so you can turn them on or off at a given position.  The difference is the sound is just a bit more professional if the wah isn't always turning on or off at the top of the wah frequency.  Suppose you wanted to set the wah in the middle, and just leave it there.  You can't really do that with this pedal.  It is a bit smaller than a morley wah, but in my experience, the sound is equivalent on the base models.",3,Step to turn on/off,1209686400,"05 2, 2008"
A37A41GWQFMK3D,B0002CZVK0,399,,,this is my first petal of  any kind.  I had read that the Wah shoud be your first so I went with that.  glad I did.  this Wah petal is so much fun.  you can make as many cool sounds as your imagination will allow.  It is hours and hours of fun.  the sounds are great.  I have had no problem with performance.  it works as it should.  I highly recommend this petal.  it's price is attractive as well.,5,I love it.  works great.  so many possibilities,1319068800,"10 20, 2011"
A3IKOEE8Z3T6BH,B0002CZVK0,209,,,I love this wah. It's just perfect. I really can't find any negative about it. It's just a perfect standard wah. You won't regret this purchase at all. Just put a good analog fuzz after it & you're good to go.,5,Original is still #1,1291507200,"12 5, 2010"
A3E7O9NSS47TE8,B0002CZVK0,148,,,I've got a MXR MC404 CAE for my concert line pedals... but this one is the one I use for local gigs and home use with Fender Telecaster and Hot Rod.,5,Nothing sounds like the classics!,1364169600,"03 25, 2013"
A3APKXMNJAEDQM,B0002CZVK0,117,,,"Finally broke down and got a new one after my original crybaby bought in 1976 finally died. A great pedal, well made!",5,The Original,1352505600,"11 10, 2012"
