reviewerID,asin,,,,reviewText,overall,summary,unixReviewTime,reviewTime
A2C7BOQVFH1HLE,B0002CZSJO,487,,,I've seen and used many different types of capos over the years and they range from the very cumbersome and difficult to use to the easily breakable but I've never used one as convenient and as well constructed as this Kyser one.  It is by far the best I've ever seen and I've been using it for years now and it still works fine.  It makes moving the capo quickly a cinch and the gold doesn't corrode or tarnish making it look like new even after all these years.Very highly recommended!,5,The Best Capo I've Ever Used!,1229644800,"12 19, 2008"
A2IN5BKM9IQT6Z,B0002CZSJO,136,,,"It is very well made, is easy to use, and holds down the strings just fine.  It is well protected as to not scratch or nick your guitar.",5,This Gold Capo matches the gold keys of my guitar,1372032000,"06 24, 2013"
A2XF1IANVPK7F,B0002CZSJO,43,,,"Durable, affordable, easy to grasp and use.",5,easy to grasp and use,1403913600,"06 28, 2014"
A22LLQ00V32YZJ,B0002CZSJO,110,,,This capo is as good as I've ever used and its in pink which perfectly matchs my shell pink strat. Great deal.,5,This capo is as good as I've ever used and its in pink which ...,1404691200,"07 7, 2014"
A56EP6FFRH1YT,B0002CZSJO,762,,,"I currenty use two types of capos - the Kyser one and Shubb capos.  Both are the most popular capos around but have different strengths and weaknesses.The benefits of the Kyser is that it is the quickest changing capo I've come across, doesn't require tension adjustment, and can clip to the end of the headstock when not in use.  The primary benefit of the Shubb is that it has adjustable tension (and second, it's smaller).The main drawback of the Kyser is the lack of adjustable tension.  Because it's designed to work across the fretboard, it will apply more force than necessary to clamp down the lower frets, causing frets to wear faster over time.  Because of this I prefer to use the Kyser on my less expensive guitar and the Shubbs on the guitar I baby.",4,Quickest changing capo,1250985600,"08 23, 2009"
AFUXETAHFUXFE,B0002CZSJO,103,,,Easy to useGreat quality and I am looking forward to purchasing more of this brand. Thank you very much,5,Great,1399852800,"05 12, 2014"
A1YA2BPU7CVNJD,B0002CZSJO,238,,,"Got what I needed - a basic capo for a good price.  The tension is a little tighter than I'd like, but works for me.  Covers all strings, and depresses them fully.  I don't use it often, so I can't speak to its longevity, but good for me!",4,Basic capo,1365206400,"04 6, 2013"
A14PY68SX7D5DV,B0002CZSJO,628,,,"I've played guitar for 5 years. Seen many different capos, but none that quite satisfies me as the Kyser.You really can't go wrong with this capo. It is very mobile, easily adjustable, sturdy, and durable.What's good about this capo is that you can use it as a regular 6 String capo and still turn it around to use it asa Cut capo. The transparent rubber piece does the same job.It comes in different colors also.I own the black, silver, gold, and camo Kyser capos.I also own the Cut Capo for other styles.I recommend it!All the capos I've had from Kyser are still in great conditions.Use them all the time at church and at home",5,Best capo out there!,1315612800,"09 10, 2011"
A2J4UAF6RW13WK,B0002CZSJO,358,,,I started using Kyser capos a couple of years ago and have never looked back since. I now own several of them and have not had any problems with any of them. They work great on acoustic and electric guitars and they have survived the many children I teach lessons to even though they get treated rather rough at times. Great capos. You won't be disappointed.,5,Perfect capos,1371600000,"06 19, 2013"
AAGD3GA9ZVPLQ,B0002CZSJO,236,,,"The handle and spring strength make this uncomfortable to place on the guitar, and I feel rushed to clamp on the capo because it's unpleasant to use - hurts the fingers. It's cheap and easy to use. It'll do the job, but I don't like it.",2,It's OK but I wish I'd bought something else.,1379548800,"09 19, 2013"
A3D0PD45BHLXFX,B0002CZSJO,210,,,What's to say?  It's not a high end capo and for the price I can lose it ( like most of the other capos I have owned).  It's not a high quality capo and it does take a few adjustments to get it seated properly.,3,A reasonably decent capo that you can afford to leave somewhere,1383436800,"11 3, 2013"
A1BTNPMESS99PL,B0002CZSJO,226,,,"I originally bought this for my guitar and it worked very well for that, so I tried it out on my 4 string uke and it works just as great. It's so much better than the elastic capos. So, it's doing double duty and going strong.",5,Works great for my ukulele,1274745600,"05 25, 2010"
AEN6KDJ3AJDK6,B0002CZSJO,138,,,"This style of capo CAN throw your guitar out of tune if you don't put it on right. When used correctly though, it does it's job just fine.",5,It's a capo,1375142400,"07 30, 2013"
AOINAOO0NQRGN,B0002CZSJO,304,,,"I can only repeat what everyone else has already said: this Kyser capo is designed and built very well. It's easy to put on and adjust, and just as easy to take off. There are probably a few capos out there that are a bit flashier, but this is still pretty stylish. And the price makes it a real bargain.",5,And all together now...,1330473600,"02 29, 2012"
A26E1V45R24QVC,B0002CZSJY,453,,,"I don't believe there is such a thing as a perfect capo, but this one is quite good.  For those with reasonably strong hands it is pretty easy to use.  It does a very good job of compressing the strings to the frets and is definitely well built.  It is as with all capos,  important to take it off when not in use so the ""rubber"" does not get grooved.  This is just good common sense.  If this lasts a couple of years I will definitely purchase another.",4,"Good, effective capo",1287100800,"10 15, 2010"
A2EWLWNMF65J5X,B0002CZSJY,166,,,I bought a 12 string one in blk.  Love it for simplicity and needed it so I didn't have to keep searching for the other.  Got gold to remind me it is for six strings.,5,2nd one,1339372800,"06 11, 2012"
AQES9A9BCJ7CV,B0002CZSJY,195,,,"I have used a few different capo's this is far and away my favorite. Very easy to take it off, holds the strings tight. What more can you ask for? Does what it sets out to do and its inexpensive.",5,Great Capo.,1277942400,"07 1, 2010"
AEMC16IPBZORW,B0002CZSJY,163,,,It does what it says. It a Kyser Quick Change capo. This capo is great for changing keys in the middle of a song or anytime you are in a hurry. Highly recommended.,5,Great capo for quick changes.,1249776000,"08 9, 2009"
A2YTKPGZXFFKVK,B0002CZSJY,257,,,"It's a capo... nice fit... yet, sometimes I wonder if it fits too tightly, as when I use it, and of course the strings are tighter, sometimes I feel that playing with this particular capo makes my strings too tight...yet, it is a capo, structured very well.",4,NICE!!!!!!!!,1365206400,"04 6, 2013"
A2FGSRTR4XFHMC,B0002CZSJY,236,,,I am very pleased with this purchase. The strings play very clearly with zero buzzing on any position between frets. I can dramatically hear and feel the difference than when I used a cheap $5 capo before. This is well worth your pay :),5,Excellent!!,1348185600,"09 21, 2012"
A1786LAQ18LHDC,B0002CZSJY,115,,,My husband usese this capo almost everytine he plays his guitar. His old one lasted about 10 years. Worth the cost.,5,Good quality,1356912000,"12 31, 2012"
A27UAE2PME5TRV,B0002CZSJY,561,,,"Long time Shubb user, but decided to try something different.I think I've found how lazy I am. I ended up using the Kyser more often than the Shubb because of the fact that you can put the Kyser on the peghead.Reaching my hand to an always available position on guitars (i.e. the peghead) for the Kyser turns out to be much more convenient than reaching to something that is not on the guitar and that could change according to situations, e.g. maybe just by my side on the sofa in my living room, maybe a table or the floor in some other places, for the Shubb.",5,Convenience won,1294444800,"01 8, 2011"
A1MH0P8PE6AT4P,B0002CZSJY,111,,,These Capos are wonderful. Perfect all the way around! long lasting and backed up by the company. I have three!,5,Kyser makes the best!,1353369600,"11 20, 2012"
A2IRI1NFJJJ6MZ,B0002CZSJY,296,,,Good strong spring and good strong materials.  The only improvement I would make is the clear protector that holds behind the neck.  The protector needs to be longer.  As the protector ages it slips off the end.  If it had more surface extended from end to the base where it pivots it would help.,4,Kyser capo,1364428800,"03 28, 2013"
A1VQHH85U7PX0,B0002CZSJY,1140,,,"I bought this Capo for myWashburn D10. It works on my Orlando classical guitar as well. I wanted a capo that was simple to operate and wasn't too expensive - and the Kyser Quick Change Guitar Capo fits the bill nicely:[Update 7/25/10: My Orlando guitar was stolen. Boo Hoo!!!]- Easy On, Easy OffThe spring mechanism makes it easy to put the capo on or take it off.- Rubberized ClampsRubberized clamps helps prevent the Kyser from scratching or marring the neck and the frets.- ErgonomicThe arched arm with the weird-looking loopy looking thingy and the other straight arm help you to firmly grab on to them without slipping so you can easily and quickly remove or reposition the Kyser Capo.- DurableThe Kyser is made from durable aluminum.[Update 7/25/10] I've had this capo for almost 3 years and it's still working like a champ! (According to Amazon's Instant Order Update for moi, I got this capo on  November 22, 2007.)- The Same Capo Colbie Caillat Used in BubblyCheck out the music video! It's the same capo Colbie Caillat used inBubbly!---The Kyser Quick Change Guitar Capo is excellent! I don't think you can go wrong with this one!",5,Works For Me!,1244246400,"06 6, 2009"
A3V1A3C9DTLPME,B0002CZSJY,580,,,"I have owned several of these over the years and own a silver colored one presently. The price is right for these, and they work just fine. My only real issue is that sometimes, they will bunch or bend strings when setting them on whatever fret you're going to bar, thus producing a sound you weren't looking for. Some of the higher end capo's counter this by having screws and such rather than a spring. However, like i say, these work fine with a little care and attention to their placement on your fretboard, and are from what i can tell, the most popular model on the market.",4,They work pretty well.,1310774400,"07 16, 2011"
A2D9QW4TY8CFB0,B0002CZSJY,253,,,"Easy to use capo. Good strength - holds the strings down well.. Not sure that it's as good as the G7th capo, which I still find is the best for holding the strings down evenly so that they stay in tune, but the Kyser is much cheaper and does a good job.",4,Kyser capo,1359244800,"01 27, 2013"
A16Z3HTUIYPDH8,B0002CZSJY,116,,,"Probably the best kapo out on the market. Very high quality and a sleek look. Easy to use, what more could you want?",5,Industry Standard,1363132800,"03 13, 2013"
A3GSQE0LXPG9YF,B0002CZSJY,191,,,"I use the capo for my guitar and it sounds awesome. I like to put the capo on the first fret and when I play a song I made, it sounds really really good. The capo is very easy to use as well.",5,Great product. I love the capo they made,1337558400,"05 21, 2012"
AB0XOMFCYELCK,B0002CZSJY,164,,,"The description says the color is gold.  It's not.  More of a greenish yellow, but does what it is intended for.  I think I would stick with the black color though.",3,Just an ok capo,1359763200,"02 2, 2013"
A3BH9XC0BVO1AG,B0002CZSJY,710,,,"I really like my capo, the blue looks good with my light natural finish accoustic, and it works as it should. However, I feel like it deserves 4 stars simply because it could be a much more robust product. For example, I think the bottom part of the clamp should be a little longer, and rounded (the back side of a guitar neck is rounded, after all). The spring could definitely be tighter...I do rarely notice buzz from not quite being tight enough. Also, the design is fairly nice, but it's mostly aesthetic...it's not really super comfortable and easy to move around necessarily.Don't get me wrong, this is a rather good product, and it's priced about right. It just isn't a high end product/5-star perfect.",4,"Works well, looks nice, minor complaints",1335052800,"04 22, 2012"
A3NKSY3I0UW3KK,B0002CZSJY,106,,,The package arrived on time. This is the best capo around and works great. Does what it is supposed to do.,5,Capo,1348963200,"09 30, 2012"
A3UQS40N3PW18L,B0002CZSJY,138,,,"works great. Just clip it on and jam out.forget the screw on type, and spend the few extra bux for this one.  you'll be happier, trust me.",5,excellent,1341360000,"07 4, 2012"
AI45J5737CUGY,B0002CZSJY,159,,,I chose the patriotic design for obvious reasons.  It is lovely.  Clear shard silk screening.  The capo itself is really good.  It is very snug on the strings.,5,Beautiful piece,1356220800,"12 23, 2012"
A18X6ZT4AEYVKB,B0002CZSJY,108,,,"i got pink cause nobody would steal it, and we all know how often capos get stolen from people pink is great",5,pink,1355270400,"12 12, 2012"
A3BZ9EP6SSC9MU,B0002CZSJY,124,,,"This capo is awesome, it looks and feels very nice and premium, it works on all of my guitars not much more you can ask for.",5,Nice Capo,1361664000,"02 24, 2013"
A12SSZIN555FTL,B0002CZST4,277,,,These Martin strings (M170) aren't bad. They just are not the sound I was looking for. I ended up like the Ernie Ball Earthwood extra light instead. The Martin's are little shallow on the low end unlike the Ernie Ball. Other people will love them though. They are easy to play.,4,not my taste,1316822400,"09 24, 2011"
A2PDPIVN721PZ7,B0002CZST4,179,,,"These are good for the average guitar player who doesn't want to much strain or pain on there fingers. Not the fullest tone, but you wouldn't expect that with extra light strings.",5,"Not the fullest tone, but you already knew that",1383955200,"11 9, 2013"
A5RJ7TM82RH0I,B0002CZST4,352,,,"I have an electro acoustic Martin (second hand but without a scratch). I got it with .13 strings and well, is simply too much. Is good to play rithyms but can't do pretty much nothing else.I have installed a set (I got 8) and it sounds really good. Not as solid as the .13 but now i have more range to do solos and go up and down much easier.Recomended",5,Sounds Perfect,1375488000,"08 3, 2013"
A2IN5BKM9IQT6Z,B0002CZST4,180,,,"Martin makes great sounding strings.  I decided to use Light Martin strings (.12) because they sounded louder and better, and I could play them just as easy as the lighter strings.",4,Great strings,1372032000,"06 24, 2013"
A21WZ0YAMX0NLE,B0002CZST4,145,,,Strings are not just strings. Guitar strings are another very important part of playing GREAT Guitar. And all Martin products are second to none.,5,Strings,1392508800,"02 16, 2014"
A2E2CJWPL1YMAR,B0002CZST4,196,,,"I replaced a set of strings that were very used with these Martins.  They are, as named, very light.  They are easy on my fingers and give great tone.  Quality company, great strings, great price!",5,My fingers love these.,1354320000,"12 1, 2012"
A1AWXXBQRQN13I,B0002CZST4,413,,,"I ordered a couple sets of this strings so I would have some extras for myself and my 6 year old son who is just starting out on guitar. this strings have good sound and hold a tune well. the best thing is the price is great. Like I said I am usinging these on mine and my sons guitar and my son was breaking string from playing to hard, but with these string it does not break the bank to replace them as needed.",5,great strings that don't break the bank,1309219200,"06 28, 2011"
A1IDPIC36H49JX,B0002CZST4,125,,,"The name Martin says it all & has for many,many years.Grab some extras because you will want more, Great price,great strings.",5,PK,1320796800,"11 9, 2011"
A1LI9W7A0CYOHV,B0002CZST4,285,,,"I love these strings, and use them for all of my acoustic playing. Best of all, I can find them here for $3.49 per set, so I'm not dumping a bunch of money on strings all the time. Easy to play, and they sound great.long lasting if you take care of them by wiping them down every time.",5,Best Acoustic Strings,1373673600,"07 13, 2013"
A3EIML9QZO5NZZ,B0002CZST4,115,,,these strings provide a warm crisp tone that makes any dreadnought guitar sound like heaven I use them all the time,5,Best product,1339200000,"06 9, 2012"
AEUG4DYQZJ64Z,B0002CZST4,175,,,Good strings with good sound.The Extra Light is easier on the fingers - but they sound thinner too.Go for the Light gauges for more solid sound if you can handle the pressure.,5,"Good, I like it",1379980800,"09 24, 2013"
A165EMA3YTIM6A,B0002CZT0M,524,,,"This is my third pack; the 1st pack has been using for two months, the sounds are rich and full, and the feels are still good.  I broke the high E on the 1st attempt of restringing, and luckily I had bought 2 packs at the same time.  So, I want to keep a completed pack for back up.  I have been fingerpacking for quite long time recently, sometime, i will practice for 4-5 hours+ until i'm tired for the session.  I have used light steel strings on my acoustic, but these ones are easier for fingers even just tiny lighter.",4,My Third Pack,1332374400,"03 22, 2012"
A3M4FU3WQWJHMP,B0002CZT0M,192,,,These are okay strings for the Folk Guitar.............nothing special but the price isn't out of the world either. Good buy for the money. Tried them on a Gibson J50 and they seem to do good.,4,Okay Strings for folk guitar,1377993600,"09 1, 2013"
A34G1GTMQGEDUN,B0002CZT0M,718,,,"I am yet another one of those ""Forever Beginners"" when it comes to playing the guitar. Never mind that...these guitar strings made second hand guitar sound so much better! After putting in new pegs and re-stringing with these strings...it sounds so much nicer! More richer! Now I see I need to replace the saddle and bridge on it as the pegs keep coming loose. I think that once I do this and then re-string these same strings on it...I will be set to go!I like that these strings are light as due to not having had much practice for a number of years...let's face it...my fingers get sore when playing! I also have small fingers and hands.I intend to continue purchasing these same strings for future use.I recommend!",5,Love these guitar strings!,1364169600,"03 25, 2013"
AQDHNCD25PFE6,B0002CZT0M,196,,,"I restrung my Martin 0-16NY with these strings and found them to be excellent.  As a new guitarist,the light strings were very easy on my sensitive finger tips and have a very warm and rich sound.",5,Very Impressive product!,1326240000,"01 11, 2012"
AN73VQ17FZVJ8,B0002CZT0M,229,,,"Even though these are folk strings, I put them on my 35 year old dread and they sound really good.I hope they last longer than some of the reviews indicate.I also wipe them down after playing to minimize tarnishing.So far so good",5,Sound good on a Dread too.,1379289600,"09 16, 2013"
A1IDPIC36H49JX,B0002CZT0M,209,,,"Great,great sound. The sound of these strings is different than any other strings you could get. They also teach a guitar player to use a lighter touch while playing to produce beautiful sounds. Well worth it.",5,PK,1320796800,"11 9, 2011"
A3ADSZR7QAQ5U,B0002CZT0M,159,,,the string work well but did not give the mellow sound on my guitar that I was looking for. The shipping was quick and the strings were recieved in good order.,3,Silk and steel strings,1386460800,"12 8, 2013"
AZBUUKQLYKUCL,B0002CZT0M,388,,,"I love these strings.  I bought a set awhile back for my Ovation, but never used them.  Then I came into possession of an old Yamaha acoustic guitar which was pretty beat up and needed new strings.  I put these suckers on there and wow was I impressed.  Even that old beater guitar sounded great and played easily with these strings.  So... I bought another set for the Ovation this time!",4,Sound great!,1395878400,"03 27, 2014"
A22SZV0N4O2FQM,B0002CZTIO,731,,,I bought this pick holder because I hate putting a pick between my strings to hold it and because you can't play with a pick in your strings. I originally thought this thing would be kind of large and go all the way across the headstock. Boy was I wrong. The picture is misleading.  This thing is tiny and barely goes across three string. It wedges under neath two strings and you can put two picks (maybe more if they are thin) into the wedges on top. Stays in place well and is very convenient.Only negative is I don't know how long it will hold up. I think maybe a thicker rubber rather than this foam rubber would have held up better. I can see this thing eventually losing tension in the pick holder wedges and dropping picks.,4,Nice little pick holder,1288828800,"11 4, 2010"
A1QE7VZE507TO7,B0002CZTIO,275,,,I really like these things.  I don't stick tape and stuff to guitar body which if they do make a double sided tape similar to post it notes might be a good idea.  Bought a few while back and just bought a few more.  If you drop a pick there is another right there.  Have fun.,5,this is second batch i ordered,1376870400,"08 19, 2013"
AOCBJFQ7UPEOJ,B0002CZTIO,164,,,I love the idea that you don't need a pocket in your strap or elsewhere to store your pick. Further it will not add something else to find/loose in my pants pocket.,4,Love the concept,1376870400,"08 19, 2013"
AH0XON4XDOF2C,B0002CZTIO,111,,,it's good but think its a bit expensive for just one they should give you two for that price or lower the price,2,ok pick holder,1390608000,"01 25, 2014"
ALV33FTOC032I,B0002CZTIO,98,,,"Doe's not stay on to well, moves to much even if you go for the pick lightly could be redeisigned.",3,OK,1365552000,"04 10, 2013"
A3USVJXZXK7XRI,B0002CZTIO,156,,,"After buying this product, I have concluded that $8.00 is a lot of money for foam! Does the job, but I think the velcro job would be preferable to this one.",3,lot of money for foam,1383091200,"10 30, 2013"
A2053ZJUGCKUA5,B0002CZTIO,225,,,Excellent simple product. Fits all of my guitars and stays out the way while playing. Easily holds 2 picks at at time on each end. Has grooves on ends and one can slide it down so that at least 2 strings fit into the grooves.,5,Very Good Pick Holder,1362528000,"03 6, 2013"
A2D0F87RY5YMHN,B0002CZTIO,355,,,Since I bought these little gadgets everybody playing guitar around want them.I use to misplace my picks all the time when playing and now I do not have to look around for them any longer as I know where to find them.  I like to use different gage picks therefore.  I have ordered more for Christmas stocking stuffers whicdh will be enjoyed by my friends.,5,A great gadget add on to my guitars.,1354492800,"12 3, 2012"
AZE83O4F1IJPR,B0002CZTIO,150,,,"It's a lot smaller than the picture makes it look, but that's a good thing. It serves it purpose and fits snugly between the strings on the headstock.",5,Handy.,1355443200,"12 14, 2012"
A10H2F00ZOT8S2,B0002CZTIO,420,,,"I'm using this right now on my acoustic and it does its job in respect to holding your picks. It was smaller then I would have pictured, but it still is a good product. It can hold light to heavy picks and its super easy to put it and take it off. Only problem I had was that it moves a lot when putting my pick back in. Besides that, its highly recommendable to anyone. I will definitely pick up more for my other axes.",4,Decent pick holder,1362873600,"03 10, 2013"
A2VCXIAWCPQ13P,B0002CZTIO,852,,,"Not too much to say, it's made out of foam, made to slip between the strings, made to hold two picks.  I have several of these, for acoustics and for electrics.  My son lost one before during a performance on stage so it is not that secure that it won't be dislodged, still, it does stay on majority of the time.  I do recommend this.  My son's guitar teacher calls this a ""fancy little pick holder"" and I've had people ask where to buy one when they see it for the first time.  One must also be careful, my son lost one of these so I know it is a possibility of it falling off.  He lost it after performing in a play on stage.Please click YES if my review have been helpful to you, it will encourage me to continue writing and updating my reviews, and leave a comment if you have any questions, I will be more than happy to answer if I can be of help.",4,It's a wedgie,1346198400,"08 29, 2012"
AXP7888CP2222,B0002CZTIO,164,,,"I use this to hold my picks on my acoustic guitar. Got tired of losing picks in mid jam, digging through pockets, scavenging for another pick. Now it's right there.",4,It Works!,1330473600,"02 29, 2012"
AGDWVRFL81B4O,B0002CZTIO,868,,,"I have been using these for months now with 5-string bass. I think these are even more useful for bassists than guitar, as I often find myself playing with fingers, then suddenly a ""pick song"" starts and... where's a pick? I usually have to offset it, and with the tuner placement I can only fit one pick, but I still find them indispensable. And no tape or other sticky stuff!There is also a model made specially for bass. [Updated] I now have the bass model on all of my basses. It is definitely better for thicker strings.The guitar model is now on my Gibson Explorer. I do love it, but the ""spreading strings"" on the headstock makes it less secure than is perfect. So, still highly recommended if your headstock has a ""straight through"" design, not so much if you have a jackson or other radically angled headstock. (They should make a Metal Edition for that. :) )",5,Back to order more,1308960000,"06 25, 2011"
A1T4HGVX32QIYC,B0002CZTIO,153,,,"This thing does just what it was supposed to, i use it on my practice bass since i use any type of picks on that, and it does just what it is supposed to",4,Good Product,1368748800,"05 17, 2013"
